Nom Subcategoria;Informació;Contacte;Horaris;Pàgina web;Direcció
SERVEIS GENERALS VIOLÈNCIA MASCLISTA ;Serveis i recursos per a prevenir, detectar, atendre i erradicar les situacions de violència masclista.;;;https://ajuntament.barcelona.cat/dones/ca/bcn-antimasclista/serveis-atencio-vers-la-violencia-masclista;
PIAD;Els Punts d’Informació i Atenció a les Dones (PIAD) són serveis públics, gratuïts i confidencials de l’Ajuntament de Barcelona on s’ofereix informació, assessorament i orientació a les dones en diferents àmbits. També s’ofereixen serveis gratuïts d’atenció psicològica i assessorament jurídic.;"
900922357 - 936197311";de dilluns a dijous de 9 a 19 h i divendres de 9 a 16 h;https://ajuntament.barcelona.cat/dones/ca/informacio-i-atencio/a-les-dones/punts-informacio-i-atencio-a-les-dones-piad;Pça. Major de Nou Barris, 1
ASSIR;Atenció a la salut sexual i reproductiva.En l’àmbit preventiu, educatiu, assistencial i promoció de la teva salut.;933546521;;https://assirbarcelonaics.wordpress.com/on-som/;c/ Chafarinas 2-8, 1a
SARA;atenció ambulatòria específica a persones víctimes de situacions de violència masclista (dones, infants i adolescents, i persones LGTBI, o persones del seu entorn proper directament afectades per aquesta violència).; 900922357;de dilluns a dijous de 9.00 a 19.00 hores i divendres de 9.00 a 16.00 hores.;https://ajuntament.barcelona.cat/dones/ca/bcn-antimasclista/serveis-datencio-la-violencia-masclista/sara;c Marie Curie, 16
Servicio atención violencia ;Si tens coneixement d’alguna dona que estigui en situació de violència masclista, passa-ho amb la màxima prudència, discreció i cura. ;900900120;24hx365d ;; 900900120@gencat.cat
Accions Fem;Lluitar i defensar els drets de les dones ;931976833 /info@accionsfem.org ;;https://www.accionsfem.org/;C/ Luz Casanova, 8
LGTBI;El Centre ofereix un ampli catàleg de serveis d’atenció directa adreçat a les persones LGTBI, tant a nivell personal com grupal i familiar. ;938805111 / info@centrelgtbibcn.org;;https://ajuntament.barcelona.cat/lgtbi/ca/serveis/centre-lgtbi-de-barcelona/serveis;C/Compte borrell 22
